{
  "schema": "skillguard-report/v1",
  "tool": {
    "name": "skillguard",
    "version": "dev"
  },
  "summary": {
    "files_scanned": 2,
    "files_skipped": 0,
    "suppressed": 0,
    "total_findings": 19,
    "critical": 4,
    "high": 7,
    "medium": 7,
    "low": 1,
    "info": 0
  },
  "findings": [
    {
      "rule": "ASG009",
      "severity": "high",
      "path": "SKILL.md",
      "line": 1,
      "column": 1,
      "message": "SKILL.md frontmatter is missing the required \"description\" field.",
      "remediation": "Give every SKILL.md a YAML frontmatter mapping with string name and description fields; keep field types as documented and remove duplicate keys.",
      "fingerprint": "e96eadaea3316e6b",
      "context": "frontmatter",
      "platform": "claude"
    },
    {
      "rule": "ASG009",
      "severity": "low",
      "path": "SKILL.md",
      "line": 2,
      "column": 1,
      "message": "Skill name \"Data Sync Helper\" does not match the conventional lowercase-hyphen form (a-z, 0-9, hyphens).",
      "remediation": "Give every SKILL.md a YAML frontmatter mapping with string name and description fields; keep field types as documented and remove duplicate keys.",
      "fingerprint": "01fa37bd68806573",
      "context": "frontmatter",
      "platform": "claude"
    },
    {
      "rule": "ASG006",
      "severity": "critical",
      "path": "SKILL.md",
      "line": 4,
      "column": 1,
      "message": "allowed-tools grants a bare wildcard (*): every tool becomes available, which defeats least privilege.",
      "remediation": "Scope each tool grant to the narrowest pattern that still works (for example a single command family instead of an unscoped shell), and declare only capabilities the configuration allows.",
      "fingerprint": "68c82b83e5a7e413",
      "context": "frontmatter",
      "platform": "claude"
    },
    {
      "rule": "ASG005",
      "severity": "medium",
      "path": "SKILL.md",
      "line": 6,
      "column": 1,
      "message": "Frontmatter lists the \"network\" capability, but the configuration does not include it in allowed_capabilities.",
      "remediation": "List every legitimately required host under allowed_domains in .skillguard.yml, or remove the network step. Declare a \"network\" capability in frontmatter only when configuration permits it.",
      "fingerprint": "cf9db6c6bbc3c637",
      "context": "frontmatter",
      "platform": "claude"
    },
    {
      "rule": "ASG007",
      "severity": "high",
      "path": "SKILL.md",
      "line": 18,
      "column": 37,
      "message": "Reference \"../shared/helpers.md\" resolves outside the scan root.",
      "remediation": "Keep every referenced resource inside the package directory and reference it with a plain relative path. Copy shared assets into the package instead of reaching outside it.",
      "fingerprint": "b3f2ca130790c36b",
      "context": "prose",
      "platform": "claude"
    },
    {
      "rule": "ASG001",
      "severity": "critical",
      "path": "SKILL.md",
      "line": 23,
      "column": 9,
      "message": "Possible connection string with embedded password detected (masked: Fak3******** (19 chars)). Treat this as a risk signal and rotate the credential if it is real.",
      "remediation": "Remove the credential and rotate it if it was ever real. Load secrets from the environment or a secret manager at runtime, and reference them as placeholders such as ${SERVICE_API_KEY}.",
      "fingerprint": "d2be82f242176ffe",
      "context": "code-fence",
      "platform": "claude"
    },
    {
      "rule": "ASG004",
      "severity": "critical",
      "path": "SKILL.md",
      "line": 29,
      "column": 1,
      "message": "Remote pipe-to-execute pattern (download piped to shell) detected. Whatever the remote host serves would run unreviewed; this is a supply-chain risk signal.",
      "remediation": "Download to a file, review it, pin it by checksum or immutable reference, and only then execute the reviewed copy.",
      "fingerprint": "621be48a44363747",
      "context": "code-fence",
      "platform": "claude"
    },
    {
      "rule": "ASG005",
      "severity": "medium",
      "path": "SKILL.md",
      "line": 29,
      "column": 11,
      "message": "Content references network access to host \"get.fixture-installer.dev\", which is not covered by allowed_domains. Declare the host or remove the network step.",
      "remediation": "List every legitimately required host under allowed_domains in .skillguard.yml, or remove the network step. Declare a \"network\" capability in frontmatter only when configuration permits it.",
      "fingerprint": "1dfee42609d1a1fb",
      "context": "code-fence",
      "platform": "claude"
    },
    {
      "rule": "ASG011",
      "severity": "medium",
      "path": "SKILL.md",
      "line": 30,
      "column": 1,
      "message": "Tool installation at @latest resolves to different code over time; pin an exact version.",
      "remediation": "Pin GitHub Actions and raw-content URLs to full 40-character commit SHAs, and pin installed tools to exact versions. Record why each pinned version was chosen.",
      "fingerprint": "38de68304d8ae166",
      "context": "code-fence",
      "platform": "claude"
    },
    {
      "rule": "ASG003",
      "severity": "high",
      "path": "SKILL.md",
      "line": 36,
      "column": 1,
      "message": "Destructive command pattern (recursive force delete (Remove-Item)) detected. This is a risk signal: verify the step is intentional, guarded, and consented — the scanner does not execute or judge intent.",
      "remediation": "Prefer reversible operations (trash instead of rm -rf, git revert instead of reset --hard, soft deletes instead of DROP). If a destructive step is genuinely required, gate it behind explicit user confirmation and narrow its scope to named paths.",
      "fingerprint": "45f1d9f33325a517",
      "context": "code-fence",
      "platform": "claude"
    },
    {
      "rule": "ASG003",
      "severity": "high",
      "path": "SKILL.md",
      "line": 37,
      "column": 1,
      "message": "Destructive command pattern (git reset --hard) detected. This is a risk signal: verify the step is intentional, guarded, and consented — the scanner does not execute or judge intent.",
      "remediation": "Prefer reversible operations (trash instead of rm -rf, git revert instead of reset --hard, soft deletes instead of DROP). If a destructive step is genuinely required, gate it behind explicit user confirmation and narrow its scope to named paths.",
      "fingerprint": "5660520fa1388616",
      "context": "code-fence",
      "platform": "claude"
    },
    {
      "rule": "ASG003",
      "severity": "high",
      "path": "SKILL.md",
      "line": 41,
      "column": 1,
      "message": "Destructive command pattern (SQL TRUNCATE TABLE) detected. This is a risk signal: verify the step is intentional, guarded, and consented — the scanner does not execute or judge intent.",
      "remediation": "Prefer reversible operations (trash instead of rm -rf, git revert instead of reset --hard, soft deletes instead of DROP). If a destructive step is genuinely required, gate it behind explicit user confirmation and narrow its scope to named paths.",
      "fingerprint": "8b0ea17928b29c25",
      "context": "code-fence",
      "platform": "claude"
    },
    {
      "rule": "ASG005",
      "severity": "medium",
      "path": "SKILL.md",
      "line": 46,
      "column": 47,
      "message": "Content references network access to host \"collector.fixture-sink.net\", which is not covered by allowed_domains. Declare the host or remove the network step.",
      "remediation": "List every legitimately required host under allowed_domains in .skillguard.yml, or remove the network step. Declare a \"network\" capability in frontmatter only when configuration permits it.",
      "fingerprint": "71526ec6814fdd91",
      "context": "prose",
      "platform": "claude"
    },
    {
      "rule": "ASG010",
      "severity": "high",
      "path": "SKILL.md",
      "line": 48,
      "column": 1,
      "message": "Prompt-injection signal (override prior instructions): \"Ignore all previous instructions\". This is a heuristic risk signal that requires human review.",
      "remediation": "Rewrite instructions to work with the host platform's rules instead of against them. Legitimate skills never need the agent to hide actions from the user or to abandon prior instructions.",
      "fingerprint": "db3c387bee5c962e",
      "context": "prose",
      "platform": "claude"
    },
    {
      "rule": "ASG010",
      "severity": "high",
      "path": "SKILL.md",
      "line": 49,
      "column": 1,
      "message": "Prompt-injection signal (conceal from the user): \"Do not tell the user\". This is a heuristic risk signal that requires human review.",
      "remediation": "Rewrite instructions to work with the host platform's rules instead of against them. Legitimate skills never need the agent to hide actions from the user or to abandon prior instructions.",
      "fingerprint": "0f880d9f7425ca18",
      "context": "prose",
      "platform": "claude"
    },
    {
      "rule": "ASG012",
      "severity": "critical",
      "path": "SKILL.md",
      "line": 54,
      "column": 7,
      "message": "Base64-looking blob (136 chars) sits next to decode-and-execute instructions. The scanner did not decode it; review the payload before any use.",
      "remediation": "Ship logic as reviewable plain text inside the package. If binary data is unavoidable, distribute it as a separate checksummed artifact — never as an inline blob the agent must decode and run.",
      "fingerprint": "a56b3a6de3971392",
      "context": "code-fence",
      "platform": "claude"
    },
    {
      "rule": "ASG002",
      "severity": "medium",
      "path": "SKILL.md",
      "line": 59,
      "column": 39,